,NACHNAME,VITA_KURZ
4189,Janssen,"Abitur. Ausbildung zur Krankenschwester in Wittmund. Im Krankenhaus und der ambulanten Pflege tätig, danach Lehramtsstudium in Oldenburg, bis 2021 Lehrerin an der Finkenburgschule in Wittmund. Stellv. Kreisvors. CDU Wittmund, Kreisvors. der Frauen Union im Landkreis Wittmund, Vors. der Frauen Union im Bezirk Ostfriesland, Mitgl. im Bundesvorstand der Frauen Union. - MdB seit Okt. 2021."
4190,Jurisch,"1998 Abschluss der juristischen Ausbildung, Erstes jur. Staatsexamen in Konstanz und zweites jur. Staatsexamen in Ravensburg, 2001 Promotion Dr. iur. an der Univ. Konstanz. 2019 Masterabschluss in internationalen Beziehungen, berufsbegleitendes Studium an der Fletcher School of Law and Diplomacy (Tufts University), Boston, USA. 2002 Bundesministerium für Wirtschaftliche Zusammenarbeit und Entwicklung (BMZ), Länderreferentin im Südostasien-Referat Vietnam, Myanmar, Thailand, Oberregierungsrätin, 2005 Deutsche Botschaft Hanoi (Vietnam). 2006/21 Stiftungsgeschäftsführerin - Fachexpertin Gemeinnützigkeit, Führung verschiedener gemeinnütziger Stiftungen in den Bereichen Wirtschaftsbildung, Unternehmertum sowie Entwicklungshilfe. 2013 Eintritt in die FDP, 2015 Ortsvors. der FDP Konstanz, 2016 Zweitkandidatin zur Landtagswahl. Englisch, Französisch. - MdB seit Oktober 2021."
4191,Kaddor,"Abitur. Studium Arabistik und Islamwissenschaft, Allgemeine Erziehungswissenschaft und Komparatistik, Abschluss 2003 (M.A.) Univ. Münster. 2004/08 Lehrtätigkeit Univ. Münster, Univ. Bielefeld, Theologische Hochschule Wuppertal, Univ. Duisburg-Essen. Seit 2003 Lehrerin im Rahmen des Schulversuchs ""Islamkunde in deutscher Sprache"" in Dinslaken, seit 2020 Lehrerin für Islamische Religion Gymnasium Duisburg. Arabisch, Englisch, Französisch, Latein, Türkisch. - MdB seit Okt. 2021."
4192,Karaahmetoğlu,"Grundschule in der Türkei, Hauptschule, Berufsfachschule, technisches Gymnasium, Abitur. Jura-Studium in Tübingen und Heidelberg, Referendariat. Seit 1997 selbstständiger Rechtsanwalt in eigener Kanzlei in Ditzingen. Kreisvors. der SPD Ludwigsburg. Vorstandsvors. des Arbeiter-Samariter-Bund Baden-Württemberg e. V. Region Stuttgart. Präsident der Deutsch-Türkischen Gesellschaft e.V., Berlin. - MdB seit Okt. 2021."
4193,Kasper,"2014 Abitur an der Eliteschule des Wintersports Oberwiesenthal und Eintritt in die SPD. 2014/17 Studium der Rechtspflege an der Hochschule Meißen, 2018 Diplom Familien- und Vormundschaftsrecht. Seit 2019 Zollbeamter Hauptzollamt Dresden, Tätigkeit bei der Finanzkontrolle Schwarzarbeit. 2016/18 Vors. Jusos Zwickau. Mitgl. GdP, AWO, Nabu, Vizepräsident des DRK KV Hohenstein-Ernstthal. - MdB seit Okt. 2021."
4194,Kassautzki,"Abitur an der Albert-Schweitzer-Schule in Alsfeld. Bachelorstudium der Staatswissenschaften in Passau, Beginn des Masterstudiums der Politikwissenschaften in Greifswald. Zuletzt Mitarbeiterin des Landtagsabgeordneten Christian Pegel und Leiterin des Familienservice der Univ. Greifswald. 2010/12 Vors. Kreisjugendparlament des Vogelsbergkreises. 2014 Eintritt in die SPD, Juso-Kreisvors. in Vorpommern-Greifswald, beratendes Mitgl. SPD-Ortsverein Greifswald und SPD-Kreisvorstand. Sachkundige Einwohnerin für die SPD-Fraktion im Bauausschuss der Universitäts- und Hansestadt. Mitgl. im MakerSpace Greifswald e. V. - MdB seit Okt. 2021."
4195,Kaufmann,"1996 Abitur in Heidelberg; 1996/97 Wehrdienst beim 2. Panzerflakbataillon 12 in Hardheim/Odenwald; 1997/98 Berufsbegl. Studium der Immobilienwirtschaft an der Europ. Immobilienakademie Saarbrücken; Immobilienwirt Dipl. EIA. 2001/07; Studium der Volkswirtschaftslehre Univ. Heidelberg; Dipl.-Volkswirt; 2010/15 Externe Promotion an der Wirtschaftsuniv. Bukarest; 1998/2008 Lehrbeauftragter an der Freien Christlichen Schule Heidelberg; 2008 Unternehmensgründung der Firma Kaufmann Immobilien. 2002/16 Mitgl. der CDU. Seit 2017 Mitgl. der AfD, seit 2018 Sprecher der AfD Heidelberg, Bundes- und Europadelegierter sowie Delegierter zum AfD-Bundeskonvent. Seit 2019 Fraktionsvors. der AfD-Fraktion im Kreistag des Rhein-Neckar-Kreises, stellv. Vors. des Kreistages; Mitgl. Verbandsversammlung der Metropolregion Rhein-Neckar. - MdB seit Okt. 2021; Obmann der AfD-Fraktion im Wirtschaftsausschuss, stellv. Leiter Arbeitskreis Wirtschaft der AfD-Fraktion; stellv. Vors. Dt.-Südasiatische Parlamentariergruppe und Parlamentariergruppe Belgien-Luxemburg, Mitgl. Parlamentariergruppe Dt.-Portugal und Parlamentariergruppe Luft- und Raumfahrt, Mitgl. Dt.-Französische Parlamentarische Versammlung, stellv. Mitgl. in der PV der Union für den Mittelmeerraum, stellv. Mitgl. PV der OSZE; Mitgl. Beirat bei der Bundesnetzagentur für Elektrizität, Gas, Telekommunikation, Post und Eisenbahnen; Mitgl. der Fußballmannschaft des FC Bundestag, Mitgl. der Interparlamentarischen Union."
4196,Kaufmann,"1980/83 Ausbildung zum Gas- und Wärmenetzmonteur mit Abitur in Gera. 1983/85 Wärmenetzmonteur. Grundwehrdienst. 1985/90 Studium der Energietechnik TU Bergakademie Freiberg. 1991/96 Entwicklungsingenieur Klöckner-Humboldt-Deutz AG in Köln, 1997/99 Gesellschafter und Geschäftsführer der SiliTec Ingenieurgesellschaft für Silicattechnik mbH in Freiberg. 1999/2000 Stipendium DAAD für einen Forschungsaufenthalt in den USA, 2000/10 wiss. Mitarbeiter an der Fakultät für Maschinenbau am Karlsruher Institut für Technologie. 2002 Promotion zum Dr.-Ing., 2010 Habilitation. Seit 2010 Professor für Mess-, Steuerungs- und Regelungstechnik Ernst-Abbe-Hochschule Jena, Fachbereich Maschinenbau. 2013 Mitgründer Landesverband der AfD Thüringen. MdL Thüringen Nov. 2019/Okt. 2021, Vizepräs. des Landtags März 2000/Nov. 2021, ab 2024 Kreistag Saalfeld-Rudolstadt. - MdB seit Okt. 2021."
4197,Keller,
4198,Kellner,"Aufgewachsen in Thüringen. Später Studium Politikwissenschaften in Potsdam, Canterbury (Großbritannien) und East Lansing (USA). 2013/22 Politischer Bundesgeschäftsführer von BÜNDNIS 90/DIE GRÜNEN. - MdB seit Okt. 2021; seit Dez. 2021 Parl. Staatssekretär beim BMin. für Wirtschaft und Klimaschutz und Beauftragter der BReg. für Mittelstand. Seit Okt. 2022 zudem Ansprechpartner der BReg. für die Kultur- und Kreativwirtschaft."
4199,Kersten,"1985/88 Berufsausbildung mit Abitur im VEG (Z) Köllitsch. 1988 medizinische Tierklinik Univ. Leipzig, 1989/95 Studium der Veterinärmedizin an der Univ. Leipzig, 1998/99 Assistentin einer Großtierpraxis im Kreis Düren, Promotion zum Dr. med. vet., 1999/2001 Referendariat Höherer Veterinärdienst im Land Nordrhein-Westfalen, 2001/14 Amtstierärztin Kreis Heinsberg, NRW, 2014/17 Referentin für Tierseuchenüberwachung und -bekämpfung im Ministerium für Landwirtschaft und Umwelt Sachsen-Anhalt, 2017 Referentin für Arten- und Biotopschutz im Ministerium für Umwelt, Landwirtschaft und Energie Sachsen-Anhalt, 2018 Referatsleitung Arten- und Biotopschutz Ministerium für Umwelt, Landwirtschaft und Energie Sachsen-Anhalt, 2019 Geschäftsführerin der Landgesellschaft Sachsen-Anhalt mbH, 2019/20 Vizepräsidentin (mdWdGb) Umweltbundesamt Dessau-Roßlau. 2021 Referatsleiterin Natur- und Umweltschutz in der Landwirtschaft im Bundesministerium für Umwelt, Naturschutz und nukleare Sicherheit. Mitgl. der SPD. Mitgl. Deutscher Naturrechtstag e. V., Agrarsoziale Gesellschaft e. V., Mitgl. Landesverband beamteter Tierärzte e. V., Tierärzte ohne Grenzen, Landfrauenverband Sachsen-Anhalt e. V., Bauernverband Sachsen-Anhalt e. V., DLG, Mitglied AWO Börde; bis Okt. 2021 Mitgl. Präsidium AWO Sachsen-Anhalt e. V. - MdB seit Okt. 2021."
4200,Khan,"Abitur am Kurfürst-Ruprecht-Gymnasium in Neustadt an der Weinstraße. Studium der Politikwissenschaften und British Studies an der Johannes Gutenberg-Univ. in Mainz und an der University of Salford Manchester. Tätig bei der bei der Landeszentrale für politische Bildung Rheinland-Pfalz, seit 2017 im Demokratiezentrum im Fachbereich Religiös begründeten Extremismus beim Landesamt für Soziales, Jugend und Versorgung Rheinland-Pfalz. Seit 2008 Mitgl. Bündnis 90/Die Grünen, 2009/11 und 2014/16 Mitgl. im Landesvorstand der Grünen Jugend Rheinland-Pfalz, 2010/16 Mitgl. Kreisvorstand des Grünen-Kreisverbandes Bad Dürkheim, Nov. 2019/März 2022 Vors. Bündnis 90/Die Grünen Rheinland-Pfalz. 2009/14 und 2019/21 Mitgl. Verbandsgemeinderat Deidesheim. Seit 2018 Vors. Wertzeuge e. V. - Verein für Demokratiebildung. - MdB seit Okt. 2021."
4201,Kleebank,"Abitur am Spandauer Kant-Gymnasium, Berufsausbildung zum Krankenpfleger, Studium FU Berlin und TU Berlin, Mathematik und Physik auf Lehramt, 1996 1. Staatsexamen, 1999 2. Staatsexamen. Lehrer am Kant-Gymnasium und an der Kath. Schule Liebfrauen, bis 2011 Leiter der Heinrich-Böll-Oberschule in Hakenfelde. Seit 1993 Mitgl. der SPD, seit 2018 stellv. Kreisvors. der SPD-Spandau, seit 2021 Beisitzer im Landesvorstand der SPD Berlin. 2009/15 Mitgl. Kirchenvorstand. Seit April 2022 Mitgl. im erweiterten Lenkungsausschuss im Netzwerk Sustainable Development Solution Network Germany, seit Juni 2023 Beisitzer im Landesverband Berlin Volksbund Deutsche Kriegsgräber Fürsorge e. V. - MdB seit Okt. 2021; seit 2022 Vors. Parl. Beirat für nachhaltige Entwicklung."
4202,Klein,"2000 Mittlere Reife, 2003 Abitur, Wirtschaftsgymnasium Villingen-Schwenningen. 2003/08 Magisterstudium, Rheinische Friedrich-Wilhelms-Univ. Bonn (2006/07 Auslandsjahr, Mount Holyoke College, USA). 2009 Mitarbeiterin, Alexander von Humboldt-Stiftung. 2009/10 Masterstudium, University of Oxford, GB, 2010/16 Binationale Promotion, Justus-Liebig-Univ. Gießen/University of Helsinki. 2017 Wissenschaft. Mitarbeiterin, MdB-Büro Deutscher Bundestag, 2017/20 Leiterin des Büros des Vors., CDU-Fraktion Berlin, Abgeordnetenhaus von Berlin. April 2020/Sept. 2021 Abteilungsdirektorin, Bundesverband Öffentlicher Banken Deutschlands, VÖB. Seit 2023 Generalsekretärin der CDU Berlin. - MdB seit Okt. 2021."
4203,Klinck,"1998 Abitur, 1998/2000 Bundeswehr. 2000/07 Studium der Politikwissenschaft, Dipl.-Politologe. 2006/12 touristische Hilfskraft im Kanucenter Rüdiger Laas, Preetz, 2008/17 Lehrbeauftragter an der CAU Kiel, 2010 Promotion zum Dr. rer. pol. 2012/14 Qualitätsbeauftragter in der kaufmännischen Kundenbetreuung, 2014 Master of Education, seit 2014 Schuldienst des Landes Schleswig-Holstein. Seit 2007 Mitgl. Vorstand SPD-Ortsverein Preetz. Seit 2008 Stadtvertreter der Stadt Preetz, seit 2013 Fraktionsvors. Preetz. Mitgl. Feuerwehr Preetz (Fördermitglied), Arbeiter-Samariter-Bund, Reservistenverband, Volksbund Deutsche Kriegsgräberfürsorge. ? MdB seit Okt. 2021."
4204,Klose,"2011 Abitur. 2011/15 Bachelor-Studium der Sozialwissenschaften in Berlin, Auslandssemester in Lyon, Frankreich, 2015/21 Master-Studium. 2017/18 Berufseinstieg als Gewerkschaftssekretärin beim DGB Berlin-Brandenburg. Seit 2011 Mitgl. der SPD, 2014/15 Mitgl. Bundesvorstand der Juso-Hochschulgruppen und Vertreterin der Hochschulgruppen in der AG Bildung und Forschung der SPD-Bundestagsfraktion, 2015/20 Landesvors. der Jusos Berlin, 2015/19 Mitgl. Landesvorstand der SPD Berlin, seit 2024 Kreisvors. der SPD Berlin-Mitte, Mitgl. der SPD-Grundwertekommission auf Bundesebene. Englisch, Französisch. - MdB seit Okt. 2021."
4205,Klüssendorf,"2011 Abitur Ernestinenschule am Koberg, Lübeck. 2011/12 Bundesfreiwilligendienst Lübecker Jugendring. Studium Volkswirtschaftslehre Univ. Hamburg, 2015 B.Sc., Betriebswirtschaftslehre, 2018 M.Sc. 2012/18 Mitarbeiter Thomas Rother, MdL. 2018/21 pers. Referent des Lübecker Bürgermeisters Jan Lindenau. Seit 2007 Mitgl. der SPD, 2010/12 Vors. Jusos Lübeck, 2010/17 und 2021/24 Mitgl. Vorstand SPD Lübeck, Kreisvors. seit April 2024. 2013/18 Mitgl. Lübecker Bürgerschaft. Seit 2018 Mitgl. Vorstand Lübecker Jugendring, seit 2021 Mitgl. Aufsichtsrat VfB Lübeck, Mitgl. u. a. AWO, ver.di. - MdB seit Okt. 2021; Mitgl. Erweiterter Fraktionsvorstand seit Sep. 2023, Sprecher der Parlamentarischen Linken in der SPD-Fraktion seit Febr. 2024."
4206,König,"2010 Lehrerin Realschule Rhede (Mathematik und Geschichte), 2013 Lehrerin Gesamtschule Rhede, 2017 Didaktische Leiterin der Abraham-Frank-Sekundarschule in Velen, 2020 Didaktische Leiterin der Julia-Koppers-Gesamtschule Borken-Raesfeld. 1999/2019 Mitgl. der Jungen Union, seit 2000 Mitgl. der CDU und Frauen Union, seit 2001 unterschiedliche Vorstandsfunktionen CDU Borken, 2007/23 Mitgl. Kreistag Borken, bis 2023 Mitgl. Vorstand der CDU-Kreistagsfraktion Borken, bis 2023 stellv. Fraktionsvors. der CDU-Kreistagsfraktion. Präsidentin Frauenschützen Münsterland e. V., Mitgl. Westfalia Gemen e. V., Vorstand der ehemaligen Mariengardener e. V., Mitgl. LandFrauenortsverband Hoxfeld, Mitgl. Bocholter Handwerksmuseum e. V., Mitgl. des Kuratoriums der Stiftung Westfalen-Initiative für Eigenverantwortung und Gemeinwohl - MdB seit Okt. 2021."
4207,Kopf,"Schulzeit in Mainz und Baden-Baden. Studium der Politikwissenschaft und Anglistik/Amerikanistik in Freiburg, gleichzeitig Mitarbeiterin der ehem. Freiburger Bundestagsabgeordneten Kerstin Andreae, 2019/21 Referentin im Wahlkreisbüro des Offenburger MdL Thomas Marwein, Lehrforschungsaufenthalt in Indonesien, Masterabschluss in Politikwissenschaft mit einer Arbeit zu EU-Freihandelsabkommen. Seit 2013 bei den Grünen aktiv, 2018/21 Kreisvors. der Freiburger Grünen, 2019/21 Mitgl. im Landesvorstand Baden-Württemberg. Seit Okt. 2023 Vizepräsidentin der überparteilichen Europa-Union Deutschland. Seit Juni 2024 Mitgl. der Atlantik-Brücke e. V. - MdB seit Okt. 2021."
4208,Koß,"1968/78 polytechn. Oberschule Strausberg, 1978/80 Studium Institut für Lehrerbildung Neuzelle, 1980/84 Studium pädagogische Hochschule Güstrow, 2003 Studium Sonderpädagogik. 1990/2006  Lehrerin Oberstufenzentrum Märkisch-Oderland Strausberg, 2004 Förderschullehrerin, 2006/14 Schulleiterin Kleeblatt-Schule Seelow, seit Januar 2020 Schulrätin im Staatlichen Schulamt Frankfurt/Oder. Seit 1994 Mitgl. Der SPD, 1999/2003 Mitgl. Vorst. Ortsverein Strausberg, 2004/06 Mitgl. Unterbezirk SPD Märkisch-Oberland, seit 2006 Vors. Unterbezirk SPD Märkisch-Oberland, 1998/2007 Mitgl. Kreistag Märkisch-Oberland, seit 2014 Mitgl. Gemeindevertretung Prötzel, seit Mai 2019 ehrenamtl. Bürgermeisterin der Gemeinde Prötzel. MdL Brandenburg 2014/19 und Sept./Okt. 2021. - MdB seit Okt. 2021."
4209,Kraft,"2010 Abitur in Hofgeismar. 2010/13 Bachelorstudium in Literatur, Kultur und Medien Univ. Siegen, 2013/17 Masterstudium in Literaturwissenschaft Univ. Siegen und der Åbo Akademi in Turku Finnland. Seit 2017 wiss. Mitarbeiterin und Doktorandin Univ. Siegen sowie Doktorandin an der Åbo Akademi in Turku Finnland. Seit 2018 Mitgl. Bündnis 90/Die Grünen, 2019/21 im Vorstand Ortsverband Siegen von Bündnis 90/Die Grünen. 2020/21 Mitgl. Kreistag Siegen-Wittgenstein, stellv. Fraktionsvors. Kreistagsfraktion von Bündnis 90/Die Grünen. Englisch. - MdB seit Okt. 2021."
4210,Krämer,"2011 Allgemeine Hochschulreife an der Edith-Stein-Schule in Darmstadt. 2011/12 Freiwilliges Soziales Jahr in einer teilstationären Tagesgruppe der AWO Darmstadt. 2013/22 Studium Joint Bachelor Philosophie/Soziologie an der TU Darmstadt, Abschluss Feb. 2022. Seit 2022 Studium M.A. Philosophie an der TU Darmstadt. 2015/18 Betreuung von FSJ/BFD-Gruppen bei der AWO Südhessen, 2015/18 Teamer Netzwerk für Demokratie und Courage, 2016/19 persönlicher Referent für Kultur bei Martina Feldmayer, MdL, 2018/19 Redenschreiber bei Hildegard Förster-Heldmann, MdL, 2018/19 Bereichsleiter Finanzen und Personal im 806qm (Kulturbetrieb). Gesellschafter eines Betreibers zweier Logopädie-Praxen. Vors. des Beirats Flexible Jugendhilfe Darmstadt, Vors. des Kinderschutzbunds BV Darmstadt, Vors. der deutsch-israelischen Gesellschaft AG Darmstadt, Mitgl. im Kuratorium des Deutschen-Polen-Instituts. Seit 2016 Stadtverordneter in Darmstadt. 2019/21 Landesvors. Bündnis 90/Die Grünen Hessen. - MdB seit Okt. 2021."
4211,Kreiser,"1990 Fachkraft für Abwassertechnik bei der Stadt Wolfenbüttel. 1993 Ausbildereignungsprüfung. 1995 Prüfungsausschuss für Umwelttechnische Berufe beim NLWKN. 1994/96 Fernstudium Abwassermeisterin mit Meisterprüfung. 1997/2003 stellv. Abwassermeisterin bei der Stadt Wolfenbüttel. 2003/09 Elternzeit. 2012 Berufsbildungsausschuss für Umwelttechnische Berufe beim NLWKN, 2015 stellv. Teamleiterin der Abwasserbetriebe Stadt Wolfenbüttel. Seit 2000 Mitgl. der SPD, seit 2016 Vorstandsmitgl. Unterbezirk SPD Wolfenbüttel, seit 2006 Vors. Ortsverein Evessen, seit 2015 Arbeitsgruppe sozialdemokratischer Frauen UBV-WF, seit Mai 2022 stellv. Vors. SPD Niedersachsen. Seit 2011 Gemeindebürgermeisterin in Evessen, Hachum und Gilzum, MdL Niedersachsen Nov. 2017/Okt. 2021. Seit 1987 Mitgl. ver.di. - MdB seit Okt. 2021."
4212,Kröber,"2009 Andreas Stepphuhn, 2009/10 AOK Sachsen-Anhalt, 2010 MdB Silvia Schmidt, 2012/13 Trägerwerk ""Soziale Dienste Berlin Brandenburg"", 2014/20 Industriegewerkschaft Bauen-Agrar-Umwelt, seit 2020 Eisenbahn und Verkehrsgewerkschaft. Seit 2008 Mitgl. der SPD, 2009/11 Vorstand SPD Halberstadt, 2009/14 Kreisvorstand SPD Harz, 2011/14 stellv. Vors. SPD Halberstadt. Mitgl. IG Metall, Industriegewerkschaft Bauen-Agrar-Umwelt, Eisenbahn und Verkehrsgewerkschaft, Kasseler Kreis - Forum sozialdemokratischer Gewerkschafterinnen und Gewerkschafter e. V. und der AWO. - MdB seit Okt. 2021."
4213,Kruse,"2003 Abitur in Hamburg. 2003 Studium Ökonomie Uni Hamburg mit Abschluss Dipl.-Volkswirt. 2005 Studium Economics University of Liverpool. 2007 Persönlicher Referent des FDP-Spitzenkandidaten zur Bürgerschaftswahl 2008, 2008 Geschäftsführer FDP-Bezirksfraktion Hamburg-Nord. 2008 Berater für politische Kommunikation. 2011 Geschäftsführer FDP-Fraktion in der Hamburgischen Bürgerschaft. Seit 2015 selbständiger Unternehmensberater. Mitgl. der FDP seit 2007, 2010/12 Mitgl. Bundesvorstand Junge Liberale, 2021/23 Landesvors. der FDP Hamburg, seit 2021 Mitgl. im FDP-Bundesvorstand. Mitgl. Hamburgische Bürgerschaft 2015/2020, 2015 Parl. Geschäftsführer und 2017 Vors. der FDP-Fraktion. Mitgl. im Internationalen Club der Schlitzohren, Mitgl. der Patriotischen Gesellschaft von 1765 e. V., Mitgl. im Netzwerk 80 e.V. - MdB seit Okt. 2021."
4214,Kuban,"2006 Abitur an der Europaschule Gymn. Bad Nenndorf. 2006/07 Auslandsaufenthalt in Neuseeland. 2007/13 Studium der Rechtswissenschaften an der Univ. Osnabrück, 1. jur. Staatsexamen. 2014/16 Referendariat am OLG Celle, 2. jur. Staatsexamen. 2016/21 Syndikusrechtsanwalt und Leiter für Recht und Nachhaltigkeit bei den Unternehmerverbänden Niedersachsen e. V. 2014/19 Landesvors. der JU Niedersachsen, 2019/22 Bundesvors. der JU Deutschlands und Mitgl. des CDU-Bundesvorstands, Mitgl. des CDU-Kreisvorstands Hannover-Land und des CDU-Bezirksvorstands Hannover. Mitgl. im Rat der Stadt Barsinghausen. 2015/17 Nachwuchsscout Hannover 96, Mitgl. der Kommission für gesellschaftliche Verantwortung des Niedersächsischen Fußballverbandes und Mitgl. im Kuratorium der DFB-Stiftung Egidius Braun. - MdB seit Okt. 2021; stellv. Vors. des Parlamentskreises Mittelstand (PKM)."
4215,Kühnert,"2008 Abitur am Beethoven-Gymnasium in Berlin-Lankwitz. Anschl. Freiwilliges Soziales Jahr. Ab 2009 Studium der Publizistik- und Kommunikationswissenschaft an der FU Berlin, ab 2010 Callcenter Agent. 2014/16 Mitarbeiter von Dilek Kalayci, MdA und ab 2016 von Melanie Kühnemann-Grunow, MdA. Ab 2016 Studium der Politikwissenschaft Fernuniv. Hagen. Seit 2005 Mitgl. der SPD, 2012/15 Landesvors. der Jusos Berlin, ab 2015 stellv. Juso-Bundesvors. und 2017/21 Bundesvors. der Jusos, 2019/2021 stellv. Vors. und seit Dez. 2021 Generalsekretär der SPD. 2016/2021 Mitgl. der Bezirksverordnetenversammlung Tempelhof-Schöneberg. Kuratorium Bernd Reisig Stiftung, Beirat American Jewish Committee Berlin, Herausgeber des Vorwärts, Mitgl. im Vorstand der Bundes-SGK, Gewerkschaftsmitgl. bei ver.di, IG BCE und EVG. - MdB seit Okt. 2021."
4216,Lahrkamp,"Studium der Politikwissenschaften Westfälische Wilhelm-Univ. Münster. Seit 2003 Mitgl. der SPD, seit 2016 Vors. SPD-Ortsverein Ochtrup, seit 2019 Mitgl. SPD-Kreisvorstand Kreis Steinfurt. Seit 2004 Mitgl. Stadtrat. - MdB seit Okt. 2021."
4217,Lang,"Abitur am Hölderlin-Gymnasium Nürtingen. 2012/19 Studium der Rechtswissenschaften, zunächst an der Ruprecht-Karls-Univ. Heidelberg, ab 2014 an der Humboldt-Univ. Berlin, ohne Abschluss. Seit Okt. 2012 Mitgl. der Grünen Jugend, 2014/15 Sprecherin des Bundesverbands von Campusgrün, 2019/22 stellv. Vors. Bündnis 90/Die Grünen und frauenpolitische Sprecherin im Bundesvorstand und seit 2022 Parteivors. Bündnis 90/Die Grünen. - MdB seit Okt. 2021."
4218,Larem,"1984 Abitur Landrat-Gruber-Schule Dieburg. 1984/86 Ausbildung zum Groß- und Außenhandelskaufmann. 1986/97 Marketing und Vertriebsmitarbeiter, 1992 Ausbilder-Eignungsprüfung, 1997/2010 Geschäftsführer. 2010/21 Bürgermeister der Gemeinde Messel, 2011/23 Kreistagsmitgl. Landkreis Darmstadt-Dieburg. 2017/21 Standesbeamter, 2018/23 Berufung zum ehrenamtlichen Richter am Arbeitsgericht Darmstadt. Seit 1987 Mitgl. der SPD. Mitgl. im Kuratorium des Deutschen Polen Instituts. - MdB seit Okt 2021; seit 2022 stellv. Vors. Unterausschuss Vereinte Nationen, internationale Organisationen und zivile Krisenprävention; stellv. Vors. deutsch-südasiatische Parlamentariergruppe, Mitgl. der interparlamentarischen Union."
4219,Latendorf,"Berufsausbildung mit Abitur, FA für Pflanzenproduktion. 1991/96 Studium der Rechtswissenschaften in Greifswald, 1998/2000 Referendariat in Stralsund und Speyer. Angestellte in einer Rechtsanwaltskanzlei in Neustrelitz, Angestellte im Amt für Landwirtschaft Stralsund/Franzburg, seit 2001 Referentin beim Bürgerbeauftragten des Landes M-V. Mitgl. der Partei die LINKE seit 1990, seit ca. 20 Jahren Mitgl. der Landesschiedskommission. 1994/98 Gemeindevertreterin für die PDS in Bremerhagen, seit 2019 Mitgl. Kreistag Ludwigslust-Parchim Fraktion DIE LINKE, Mitgl. im Kommunalpolitischen Forum. - MdB seit Okt. 2021; bis 2023 Sprecherin für Agrarpolitik und Obfrau im Ausschuss für Ernährung und Landwirtschaft; Mitgl. der Gruppe Die Linke."
4220,Leiser,"2012 Abitur am Gymnasium Gerabronn. 2012/13 Studium der Rechtswissenschaft und 2013/17 Studium der Mathematik und Politikwissenschaft/Wirtschaftswissenschaft auf Lehramt für Gymnasien Ruprecht-Karls-Univ. Heidelberg; 2013/17 Stipendiat der Friedrich-Ebert-Stiftung. 2018/19 Vorbereitungsdienst (Referendariat) für das Lehramt für Gymnasien am Gymnasium Weikersheim. 2019/21 Studienrat am Albert-Schweitzer-Gymnasium Crailsheim. 2013/18 Kassierer des SPD-Ortsvereins Schrozberg, 2017/19 Pressesprecher des SPD-Kreisverbands Schwäbisch Hall, seit 2021 Vors. des SPD-Kreisverbands Schwäbisch Hall. 2014/20 Engagement für den Breitbandausbau in Engelhardshausen, seit 2019 Gemeinderat in der Gemeinde Blaufelden, seit 2019 Kreisrat im Landkreis Schwäbisch Hall. 2008/11 und 2013/14 Jungscharmitarbeiter, seit 2016 Mitgl. im Hauptausschuss des Sportclub Wiesenbach e. V. - MdB seit Okt. 2021."
4221,Lenders,"1983/87 Ausbildung zum Kaufmann im Handwerk. 1988 Grundwehrdienst. 1989 Angestellter im Ausbildungsbetrieb, 1990 Angestellter Fa. Ladenbau, Niederrhein, 1994 Existenzgründung Fa. Licht + Concept GmbH in Fulda, seitdem Geschäftsführender Gesellschafter. Seit 1995 Mitgl. der FDP. 2003/11 Mitgl. der Stadtverordnetenvers. Fulda, 2004/11 Vors. der FDP-Fraktion. 2012 Mitgl. der 15. Bundesversammlung. MdL Hessen April 2008/Nov. 2008 und Jan. 2009/Okt. 2021, 2017/21 Parl. Geschäftsführer der FDP-Fraktion im Hessischen Landtag. Englisch. - MdB seit Okt. 2021."
4222,Lenk,"2002 Abitur Berufliches Gymnasium BSZ Meißen. 2002/09 Studium Bibliotheks- und Informationswissenschaft HTWK Leipzig und FH Potsdam, Dipl.-Bibliothekarin. 2009/12 Bibliothekarin, 2012/15 Bibliotheksleitung Bibliothek Hochschule für Musik Nürnberg. 2012/15 Berufsbegleitendes Masterstudium Bibliotheks- und Informationsmanagement Hochschule der Medien Stuttgart, Master of Arts. 2015/20 Bibliotheksleitung Bibliothek Hochschule der Bildende Künste Dresden. Seit 2020 Mitarbeiterin bei einem MdL der AfD-Fraktion. Englisch, Französisch. - MdB seit Okt. 2021; Mitglied AK Digitales der AfD-Fraktion, Obfrau der AfD im Ausschuss für Digitales, stellv. Mitgl. AK Bildung und AK Innen."
4223,Leye,"2000 Abitur am Albert-Einstein-Gymnasium in Bochum, 2000/01 Zivildienst in einer Beratungsstelle für wohnungslose Menschen in Bochum. 2002/06 Bachelorstudiengang Politikwissenschaft Univ. Bielefeld, 2007/09 Masterstudiengang ""International Economics"" (Volkswirtschaftslehre) Georg-August Univ. Göttingen. 2010/12 Mitarbeiter im Wahlkreisbüro Sevim Da?delen, MdB, 2012/13 pol. Jugendberater im Jugendforum der Dortmunder Nordstadt, 2014/21 Mitarbeiter im Wahlkreisbüro Sahra Wagenknecht, MdB. Feb. 2010/Okt. 2023 Mitgl. DIE LINKE. 2011/12 Sprecher von DIE LINKE Bochum, 2013/23 Mitgl. im Landesvorstand DIE LINKE. NRW, 2014 Wahl zum stellv. Landessprecher DIE LINKE. NRW, 2016/21 Landessprecher DIE LINKE. NRW. Seit Jan 2024 Mitgl. und Generalsekretär der Partei Bündnis Sahra Wagenknecht - Vernunft und Gerechtigkeit. Mitgl. ver.di, ehemaliger Studienstipendiat der Rosa-Luxemburg-Stiftung. Englisch, Spanisch. - MdB seit Okt. 2021; Mitgl. der Gruppe BSW."
