,NACHNAME,VITA_KURZ
3480,Notz,"1981/91 Freiherr-vom-Stein-Schule Frankfurt. 1991/92 Zivildienst Bahnhofsmission Hauptbahnhof Frankfurt. 1993/98 Jura-Studium in Heidelberg, 1998 1. Staatsexamen, Dissertation im Evangelischen Kirchenrecht, 2001/04 Referendariat und 2. Staatsexamen. Seit 2004 Rechtsanwalt in Mölln. Mitgl. Transparency International (TI) Deutschlands. Seit 1995 Mitgl. bei Bündnis 90/Die Grünen, 2002/11 Sprecher der LAG Demokratie und Recht von Bündnis 90/Die Grünen in Schleswig-Holstein, seit 2005 Mitgl. Parteirat Schleswig-Holstein, 2007/Anfang 2011 Sprecher Kreisverb. Lauenburg von Bündnis 90/Die Grünen. Seit 2004 Mitgl. für Bündnis 90/Die Grünen in der Möllner Stadtvertretung, seit Juni 2013 3. stellv. Bürgermeister der Stadt Mölln. - MdB seit Okt. 2009; seit Dez. 2013 stellv. Vors. der Fraktion Bündnis 90/Die Grünen, 2013/17 Obmann für Bündnis 90/Die Grünen im 1. Untersuchungsausschuss/NSA, Obmann im Ausschuss Digitale Agenda, in der 19.WP Mitgl. 1. Untersuchungsausschuss ""Berliner Breitscheidplatz"", Beauftragter für Religion und Weltanschauungen; seit 2022 Vors. Parl. Kontrollgremium."
3481,Özoğuz,"1994 Magister-Abschluss, seit 1994 wiss. Mitarbeiterin der Körber-Stiftung (ruht), 2011 bis 2017 stellv. SPD-Vors., seit 2011 Mitgl. im Parteivorstand, 2001/08 MdHB, Fachsprecherin für Integration und Zuwanderung; 2004/08 Mitgl. Integrationsbeirat Hamburg. ehrenamtl. Mitgl. Kuratorium Aktion Deutschland Hilft e. V., Bonn und Avicenna-Studienwerk e. V., Osnabrück, Mitgl. Stiftungsrat Caritasstiftung Hamburg - Menschen in Not, Hamburg, Mitgl. Kuratorium Dt. Youth for Understanding Komitee e. V., Hamburg, Mitgl. Kuratorium Internationaler Bund (IB) Verbund Nord, Hamburg, Mitgl. Kuratorium dtec-bw - Zentrum für Digitalisierungs- und Technologieforschung der Bundeswehr, Neubiberg, Mitgl. Kuratorium Stiftung Lesen, Mainz, Vors. im Vorstand Friedrich-Ebert-Stiftung e. V., Bonn, Mitgl. Aufsichtsrat Zentrum für Internationale Friedenseinsätze gemeinnützige GmbH (ZIF), Berlin, Mitgl. akad. Beirat Kulturakademie Tarabya, Istanbul, Mitgl. Beirat neue dt. organisationen, Berlin, Mitgl. Kuratorium Stiftung: Bildung! E?itim!, Würselen, ehrenamt. Mitgl. Beirat Türkisch-Dt. Studierenden und Akademiker Plattform e. V., Düsseldorf, Ethikbeauftragte Verband für Turnen und Freizeit, Hamburg, ehrenamtl. Mitgl. Vors. Vorstand Verein der Freunde und Förderer der Helmut-Schmidt-Univ./Univ. der Bundeswehr Hamburg e. V., Hamburg, Mitgl. Beirat VMW - Verband der Migrantenwirtschaft, Ethnische Unternehmer und Ausländische Arbeitgeber e. V., Berlin, Mitgl. Pol. Beirat Wirtschaftsforum der SPD e. V., Berlin. - MdB seit Okt. 2009; März 2010/Okt. 2013 Integrationsbeauftragte der SPD-Fraktion; Jan. 2014/März 2018 Staatsministerin bei der Bundeskanzlerin und Beauftragte der BReg. für Migration, Flüchtlinge und Integration; seit Mai 2020 Sprecherin der Landesgruppe Hamburg der SPD-Fraktion. Seit Okt. 2021 Vizepräsidentin des Deutschen Bundestages."
3484,Paus,"1987/88 freiwilliges soziales Jahr im Hamburger Kinderheim St. Elisabeth. 1999 Abschluss Dipl.-Volkswirtin FU Berlin. 1997/99 wiss. Mitarbeiterin MdEP Frieder Otto Wolf (Grüne). 2004 Lehrbeauftragte VWL an der FHW Berlin.1999/2009 Mitgl. des Abgeordnetenhauses von Berlin, dort 1999/2006 europapolitische Sprecherin, 1999/2000 und 2002/04 Mitgl. Fraktionsvorstand, 2001/06 stellv. Vors. Ausschuss für Wissenschaft und Forschung und hochschul- und wissenschaftspolitische Sprecherin, 1999/2009 wirtschaftspol. und 2006/09 haushaltspol. Sprecherin der Fraktion Bündnis 90/Die Grünen im Abgeordnetenhaus. Mitgl. Europa Union Berlin e. V.; Genossenschaftsmitglied Studentendorf Schlachtensee e. G.; Mitgl. Berliner Tafel e. V.; Mitgl. Verein der Freundinnen und Freunde des Otto-Suhr-Instituts e. V.; Mitgl. DLRG Charlottenburg-Wilmersdorf; Mitgl. Bildungswerk Berlin der Heinrich-Böll-Stiftung e. V.; ; Mitgl. Institut Solidarische Moderne; Mitgl. FiDAR Frauen in Aufsichtsräte; Mitgl. Forum Ökologische-Soziale Marktwirtschaft; Mitgl. Deutschen Gesellschaft für die Vereinten Nationen Berlin Brandenburg; Mitgl. Verband alleinerziehender Mütter und Väter Bundesverband e.V. (VAMV). - MdB seit Okt. 2009; 2017/22 Mitgl. und Obfrau im Finanzausschuss, grüne Vertreterin im Wirecard-Untersuchungsausschuss, Leiterin der AG Finanzen, Sprecherin der Berliner Landesgruppe, Sprecherin für Finanzpolitik und Dez. 2021/April 2022 stellv. Vors. der Fraktion Bündnis 90/Die Grünen, zuständig für Finanzen, Haushalt, Wirtschaft, Arbeit und Soziales. Seit April 2022 Bundesministerin für Familie, Senioren, Frauen und Jugend."
3493,Rief,"Grundschule Kirchberg, Hauptschule Gutenzell, Erolzheim und Kirchberg. 1975/78 Ausbildung zum Landwirt. 1978/80 Fachschule für Landwirtschaft Biberach. 1980/81 Grundwehrdienst in Großengstingen und Laupheim. 1983 Bauernschule Bad Waldsee. Realschulabschluss Abendrealschule in Biberach. 1984 Meisterprüfung. 1985 Landjugendakademie Bonn. Lange Jahre im Vorst. des Grünen Kreises der Landjugend in Biberach, Jugendvertreter im Bauernverb. Biberach, 1994/2010 stellv. Vors. Bauernverband Biberach bzw. Biberach-Sigmaringen. 1978/95 Mitglied der JU, seit 1985 Mitgl. der CDU; 1978/92 Ortsvors. JU Illertal, 1992/94 Kreisvors. JU Biberach, 1994/95 stellv. Bezirksvors. JU Württemberg-Hohenzollern; seit 1996 Vors. CDU-Gemeindeverb. Kirchberg, seit 1999 Kreisvors. CDU Landkreis Biberach, seit 2007 Mitgl. CDU-Landesvorst. 1989/99 und 2001/14 Mitgl. Gemeinderat Kirchberg, 1994/99 1. stellv. Bürgermeister von Kirchberg, seit 2002 Mitgl. Kreistag. - MdB seit Okt. 2009."
3495,Rößner,"Studium Musik-, Filmwissenschaft und Kunstgeschichte in Frankfurt/Main, Journalismus und Öffentliches Recht in Mainz, M.A. Stipendiatin des GMF, bis 2009 freie Journalistin/Redakteurin. Ehrenamtlich: Elternarbeit und Kommunalpolitik. 1986 Mitgl. BÜNDNIS 90/DIE GRÜNEN, 2001/06 Landesvors. BÜNDNIS 90/DIE GRÜNEN Rheinland-Pfalz. Mitgliedschaften: Beirat Bundesnetzagentur, Fachausschuss Kommunikation/Information der Dt. Unesco-Kommission, Kuratorium GIHF-AI, Kuratorium Fridtjof-Nansen-Akademie Ingelheim, Beirat Leiseres Mittelrheintal der DB, Bundesverband Smart City, Vorstand Rheinhessen gegen Rechts, Urstrom eG, Neue Energie Bendorf eG, BUND, VCD, WIR gegen Bahnlärm in der VG Weißenthurm, Initiative Klima-, Umwelt- und Lärmschutz im Luftverkehr Mainz, ver.di, Europa-Union, Fallschirm Mensch, Freundeskreis Gutenberg, Open Ohr, Meenzer Drecksäck, Draiser Lerchen, Aufsichtsrat der DigitalService GmbH des Bundes. - MdB seit Okt. 2009; seit Dez. 2021 Vors. Ausschuss für Digitales, stellv. Mitgl. PV Europarat."
3496,Rüddel,"Volksschule, Gymnasium, Abitur. Studium Wirtschaftswiss., Dipl.-Betriebswirt. 1985 Angestellter Verlagsgruppe Mönch, Koblenz, 1987 Angestellter VF Verlagsgesellschaft Mainz, 1993/2009 Geschäftsführer der Senioren-Residenz Bad Arolsen GmbH. Seit 1998 Präsidiumsmitgl. Rheinische Karnevals-Korporationen e. V., seit 2012 Vors. der Leichtathletik Gemeinschaft (LG) Rhein-Wied, seit Nov. 2012 Persönliches Mitgl. des Leichtathletik-Verbandes Rheinland (LVR), seit 2019 Präsident SV Windhagen. Seit 1972 Mitgl. der JU und der CDU; 1980/88 Kreisvors. JU Neuwied; 1982/92 stellv. CDU-Kreisvors., 2008/22 CDU-Kreisvors., 1988/2010 Vors. CDU Windhagen, 1991/97 und 2007/17 Mitgl. CDU-Bezirksvorst. Koblenz-Montabaur, 1997/2001 und 2003/08 Mitgl. CDU-Landesvorst. Rheinland-Pfalz, 2012/22 Beauftragter für Sportfragen der CDU Rheinland-Pfalz, 2014/18 Mitgl. Bundesfachausschuss ""Gesundheit und Pflege"" der CDU Deutschlands. 1984/94 und 1999/2021 Mitgl. Kreistag Neuwied, 2004/21 stellv. Vors. CDU-Kreistagsfraktion; 1984/2018 Mitgl. Ortsgemeinderat Windhagen, 1994/99 und 2004/09 1. Beigeordneter Ortsgemeinde Windhagen; 1994/99 Mitgl. Verbandsgemeinderat Asbach. Jan./Mai 1987 und Nov. 1998/Okt. 2009 MdL Rheinland-Pfalz, 2006/09 Vors. Arbeitskreis ""Medien und Multimedia"" der CDU-Landtagsfraktion. - MdB seit Okt. 2009; 2014/18 Berichterstatter der CDU/CSU-Fraktion für die Pflegepolitik, Jan. 2018/Okt. 2021 Vors. Gesundheitsausschuss; seit 2022 Berichterstatter der CDU/CSU-Fraktion für Digitalisierung im Gesundheitswesen."
3503,Schnieder,"1987 Abitur. 1987/88 Grundwehrdienst. 1988/95 Studium Rechtswissenschaften in Bonn, 1995/97 Rechtsreferendariat, 1998/99 Rechtsanwalt, 1999/2009 Bürgermeister Verbandsgemeinde Arzfeld. Seit 2014 Mitgl. im Vorstand der Handwerkskammer Trier, 2010/12 Bezirksvorsitzender CDU Trier, 2011/18 Generalsekretär der CDU Rheinland-Pfalz, seit 1999 Mitgl. Kreistag Bitburg-Prüm - MdB seit Okt. 2009, 2014/18 Beisitzer im Vorstand der CDU/CSU-Fraktion, seit Jan. 2018 Parlamentarischer Geschäftsführer der CDU/CSU-Fraktion, Mitgl. Ältestenrat, 2014/17 Vors. Dt.-Belgisch-Luxemburgische Parlamentariergruppe, in der 19. WP Vors. Parlamentariergruppe BENELUX, seit Sept. 2017 Vors. der Landesgruppe Rheinland-Pfalz der CDU/CSU-Fraktion, seit April 2022 Vors. Parlamentariergruppe Belgien-Luxemburg."
3507,Schwartze,"1990/94 Berufsausbildung. 1995 Fachabitur. 1998/2009 Industriemechaniker bei der Firma Kannegiesser in Vlotho. Seit 1991 Mitgl. der IG Metall, Mitgl. der Freiwilligen Feuerwehr, der AWO, des Kinderschutzbundes Vlotho und im Vlothoer Bündnis gegen das Collegium Humanum. Seit 1994 Mitgl. der SPD, seit 2006 Vors. der SPD im Kreis Herford, seit 2014 Vors. der SPD Region Ostwestfalen. 1999/2009 Kreistagsabgeordneter, 2004/09 stellv. Vors. der Kreistagsfraktion. Mitgl. DRK, Vors. THW-Helferverein, seit 2014 Mitgl. Verwaltungsrat der Diakonie im Kirchenkreis Vlotho. - MdB seit Okt. 2009. Seit Jan. 2022 Beauftragter der BReg für die Belange der Patientinnen und Patienten."
3509,Seif,"1982 Abitur. 1982/84 Grundwehrdienst. 1984/89 Studium Rechtswissenschaften an der Univ. Bonn, 1990 1. jur. Staatsprüfung, Stipendiat der Konrad-Adenauer-Stiftung, 1993 2. jur. Staatsprüfung. 1993 Zulassung als Rechtsanwalt. Seit Okt. 1982 Mitgl. der CDU, div. parteipolitisches und überparteiliches Engagement, u. a. Ende der achtziger Jahre als Vors. der Bürgerinitiative Steinbachtalsperre, Mitte der achtziger Jahre Referent zum Thema ""Menschenrechtsverletzungen in der DDR"", versch. Ämter in der CDU, 1999/2009 Ratsmitgl. der Gemeinde Weilerswist, 2009/23 Vors. des CDU-Kreisverbandes Euskirchen, 2009/23 stellv. Vors. des CDU-Bezirksverbandes Aachen. - MdB seit Okt. 2009; seit 2014 EU-Obmann der CDU/CSU-Fraktion; Mitgl. Ausschuss für Inneres und Heimat."
3516,Skudelny,"1995 Abitur. 1995/99 Studium der Rechtswissenschaften Univ. Tübingen, 2001/03 Referendariat. Seit 2003 Rechtsanwältin in einer mittelständischen Kanzlei mit den Schwerpunkten Sanierungs- und Insolvenzrecht in Stuttgart. Seit 1998 Mitgl. der FDP, seit Jan. 2015 Generalsekretärin der FDP Baden-Württemberg. Seit 2004 Mitgl. im Gemeinderat Leinfelden-Echterdingen - MdB 2009/13 und seit Okt. 2017; umwelt- und verbraucherschutzpolitische Sprecherin der FDP-Fraktion, Vors. der FDP-Landesgruppe Baden-Württemberg."
3525,Stier,"1971/81 POS. 1981/83 Ausbildung Zootechniker/Mechanisator. Fernstudium FH Stadtroda und HU Berlin, 1989 Dipl.-Ing. agr. 1985/89 Schicht- und Abteilungsleiter ZBE Milchprod. Reichardtswerben, 1989/91 Leiter Gut Storkau, 1992/95 Arbeitsgruppenleiter Amt für Landwirtsch. und Flurneuordnung Süd Sachsen-Anhalt. Seit 1990 geschäftsf. Vorstand Weißenfelser Reitverein e. V., Leiter Reit-, Zucht- und Ausbildungsstall Markwerben mit Landwirtschaftsbetr., seit 1997 Inhaber Agentur für Tierversicherungen. Richter Pferdesport und -zucht. Seit 1999 Mitgl. der CDU, seit 2003 Mitgl. CDU-Kreisvorst. Weißenfels, 2007/18 stellv. Vors. und seit 2018 Vors. CDU-Kreisverb. Burgenlandkreis, Mitarbeit CDU-LFA Landwirtschaft, 2010/12 Beisitzer CDU-Landesvorst. Sachsen-Anhalt. 1994/2019 Mitgl. Kreistag, 2004/07 stellv. CDU-Fraktionsvors., 2007/19 Vors. Kreistag; 1999/2014 Mitgl. Stadtrat Weißenfels, 2000/09 CDU-Fraktionsvors.; 2007/14 Mitgl. Verwaltungsrat Kreissparkasse Weißenfels/Sparkasse Burgenlandkreis; 2005/14 Vors. des Gemeinschaftsaussch. Verwaltungsgemeinsch. ""Weißenfelser Land"". 2010/14 1. Vizepräs. und Vors. d. LK für Pferdeleistungsprüfungen im LV d. RFV Sachsen-Anhalt, März 2019/April 2023 stellv. Vors. Pferdezuchtverband Brandenburg/Anhalt e. V. Russisch (G). - MdB seit Okt. 2009; 2013/21 stellv. Vors. der CDU-Landesgruppe Sachsen-Anhalt; in der 19. WP stellv. Vors. Sportausschuss."
3526,Stracke,"1993 Abitur. 1993/94 Grundwehrdienst. 1994/99 Studium Rechtswissenschaften an der Univ. Augsburg. Stipendiat der Hanns-Seidel-Stiftung. 1999 1. jur. Staatsexamen. 2001 2. jur. Staatsexamen. 2002/05 Rechtsanwalt. 2005/06 Landesbaudirektion München. 2006/08 Leiter Abteilung Recht am Staatl. Bauamt München 1. 2008/09 Oberste Baubehörde im Bayer. Staatsministerium des Innern. Seit 2002 Stadtrat in Kaufbeuren. - MdB seit Okt. 2009. 2012/13 stellv. Vors. 2. Untersuchungsausschuss (""Terrorgruppe nationalsozialistischer Untergrund""); 2014/21 stellv. Vors. CSU-Landesgruppe sowie arbeits-, sozial-, gesundheits- und familienpolitischer Sprecher der CSU-Landesgruppe im Bundestag; seit 2014 Mitgl. im Vorstand der CDU/CSU-Fraktion, April/Dez. 2021 stellv. Vors. der CDU/CSU-Fraktion für die Bereiche Gesundheit, Umwelt, Naturschutz und nukleare Sicherheit, seit Dez. 2021 Vors. der AG Arbeit und Soziales der CDU/CSU-Fraktion."
3532,Thomae,"1987 Abitur am Human. Carl-von-Linde-Gymnasium Kempten. 1987/88 Grundwehrdienst. 1988/93 Geschichtsstudium in München, Abschluss M. A., 1990/95 Jurastudium in München, Stipendiat der Friedrich-Naumann-Stiftung, Abschluss 1. Staatsexamen; 1995/98 Referendariat in Kempten, Speyer und Kalkutta, Abschluss 2. Staatsexamen. Seit 1998 Rechtsanwalt in Kempten. 1990/05 Dirigent Musikverein Kempten-Sankt Mang, 2000/05 Präsident Dt.-Indische Juristenvereinigung e. V., 2000/10 Stiftungsvorst. Ekkehard-Stiftung (Studienstiftung), seit 2018 Bezirksvors. im Allgäu-Schwäbischen Musikbund (ASM), seit 2017 Vors. Freundeskreis Schwäbisches Jugendblasorchester (SJBO). Seit 1999 Mitgl. der FDP, seit 2000 Mitgl. Kreisvorst. der FDP Kempten, seit 2002 Mitgl. Bezirksvorst. der FDP Schwaben, seit 2004 Mitgl. Landesvorst. der FDP Bayern, seit 2009 Bezirksvors. der FDP Schwaben, seit 2023 Mitgl. FDP-Bundesvorst. Englisch (f), Französisch (G), Italienisch (G), Spanisch (G). - MdB 2009/13 und seit Okt. 2017; 2017/21 stellv. Vors. und seit Dez. 2021 Parl. Geschäftsführer der FDP-Fraktion."
3536,Vogel,"2001 Abitur am Städtischen Gymnasium Wermelskirchen. 2001/02 Zivildienst als ausgebildeter Rettungssanitäter an der Feuer- und Rettungswache Wermelskirchen. 2009 Abschluss des Studiums der Politikwissenschaft, der Geschichte und des Völkerrechts an der Rheinischen Friedrich-Wilhelms-Univ. Bonn, Magister Artium. Frühjahr 2019 John F. Kennedy Memorial Policy Fellow, Harvard University. Seit 1998 Mitgl. der Jungen Liberalen, seit 1999 der FDP, 2004/10 Mitgl. im Bundesvorst. der Jungen Liberalen, 2005/10 Bundesvors., seit 2007 Mitgl. im FDP-Bundesvorst. und seit Mai 2021 stellv. Bundesvors., 2014/22 Generalsekretär und 2017 Wahlkampfleiter der FDP NRW. 2004/09 Kreistagsmitgl. des Rheinisch-Bergischen Kreises. 2014/17 Führungskraft bei der Bundesagentur für Arbeit, u. a. Vors. der Geschäftsführung der Arbeitsagentur Solingen-Wuppertal und Leiter Strategie und Geschäftsentwicklung der Internationalen Abteilung/Zentralen Auslands- und Fachvermittlung (ZAV). - MdB 2009/13 und seit Okt. 2017; seit Dez. 2021 Erster Parlamentarischer Geschäftsführer der FDP-Fraktion; Vors. Dt.-Pazifische Parlamentariergruppe."
3538,Vogler,"1983 Abitur Gymnasium Martinum Emsdetten. 1983/90 Studium Soziologie Univ. Münster, 1990/94 Landesgeschäftsführerin der DFG-VK NRW, Dortmund, 1995/99 Leiterin DFG-VK- Bundesgeschäftsstelle, Velbert. 1999/2002 Elternzeit. 2002/09 Geschäftsführerin Bund für Soziale Verteidigung, Minden. 1979 Eintritt in die DFG-VK, 1983/90 Jugendclub Courage NRW - Landesvorstand, 1983/2001 SPD-Mitgl., 1984/95 DFG-VK NRW Landesvorstand, 1988/90 AStA-Referentin für Kultur und Frieden, 1995/2001 DFG-VK Bundessprecherin, 2000/03 Redakteurin der Zeitschrift ""Friedensforum"", 2003 Gründung der Kooperation für den Frieden, bis 2005 Sprecherin der Kooperation, 2005 Eintritt in die WASG, seit 2007 DIE LINKE, seit 2022 Vors. DIE LINKE. NRW. - MdB seit Okt. 2009; Obfrau im Gesundheitsausschuss; Mitgl. der Gruppe Die Linke, Sprecherin für Gesundheitspolitik und Sprecherin für Queerpolitik der Gruppe Die Linke."
3539,Wadephul,"1982 Abitur an der Meldorfer Gelehrtenschule. 1982/86 Zeitsoldat der Bundeswehr, Oberstleutnant d. R. 1986/91 Studium Rechtswissenschaften an der Univ. Kiel, 1991 1. jur. Staatsprüfung, 1993/95 Referendar Landgerichtsbezirk Kiel, 1995 große jur. Staatsprüfung. 1996 Promotion zum Dr. jur. Univ. Kiel. Selbstständiger Rechtsanwalt in Neumünster und Berlin, Fachanwalt für Medizin- und Sozialrecht. Vors. Beschwerdeausschuss der Vertragsärzte und Krankenkassen in SH. 1982 Eintritt in die CDU und JU, 1992/96 Landesvors. JU Schleswig-Holstein, 1997/2000 Generalsekretär CDU SH, 2000/02 Landesvors. CDU SH, seit Jan. 2006 Vors. CDU-Kreisverb. Rendsburg-Eckernförde, 2010/20 Mitgl. Bundesvorst. der CDU Deutschlands. 2000/09 MdL in Schleswig-Holstein, 2005/09 Vors. CDU-Fraktion. Ehrenamt: Liquidator des Petersburger Dialogs e. V.; Vors. des Beschwerdeausschusses der Vertragsärzte und Krankenkassen in Schleswig-Holstein. Mitgl. Dt.-Japanisches-Forum, Dt. Gesellschaft für Auswärtige Politik e. V., Verband der Reservisten der Dt. Bundeswehr, Dt. Anwaltsverein, Europa-Union Deutschland e. V., Ortsverband Altenholz, Dt. Rotes Kreuz, Ortsverband Molfsee. Englisch (f). - MdB seit Okt. 2009; in der 18. WP Vors. Ausschuss für Wahlprüfung, Immunität und Geschäftsordnung sowie altern. Vors. Vermittlungsausschuss von Bundestag und Bundesrat, seit März 2017 Vors. der CDU-Landesgruppe Schleswig-Holstein, seit Jan. 2018 stellv. Vors. der CDU/CSU-Fraktion für den Bereich Auswärtiges, Verteidigung, Interparlamentarische Konferenz für die Gemeinsame Außen- und Sicherheitspolitik (GASP) und die Gemeinsame Sicherheits- und Verteidigungspolitik (GSVP), Europarat; Leiter der dt. Delegation in der PV der NATO; Vors. der Dt.-Südkaukasischen Parlamentariergruppe."
3540,Wagenknecht,"1988 Abitur in Berlin. 1990/96 Studium Philosophie und Neuere Deutsche Literatur in Jena, Berlin und Groningen, Sept. 1996 Abschluss des Studiums in Groningen mit einer Arbeit über Hegel und Marx, 2012 Promotion zum Dr. rer. pol. in Wirtschaftswissenschaften an der TU Chemnitz mit einer Arbeit zum Thema ""The Limits of Choice. Saving Decisions and Basic Needs in Developed Countries"". 2007/14 Mitgl. Vorstand der Partei DIE LINKE, Okt. 2023 Austritt aus der Partei DIE LINKE und Vorstellung des Vereins Bündnis Sahra Wagenknecht - Für Vernunft und Gerechtigkeit, Jan. 2024 Gründung und Vors. der Partei Bündnis Sahra Wagenknecht - Für Vernunft und Gerechtigkeit. 2004/09 MdEP, dort Mitgl. im Ausschuss für Wirtschaft und Währung, stellv. Mitgl. im Ausschuss für Industrie, Forschung und Energie. Englisch (f). - MdB seit Okt. 2009; 2009/11 wirtschaftspolitische Sprecherin und 2011/15 Erste Stellv. Vors. der Fraktion DIE LINKE., 2015/19 Vors. der Fraktion DIE LINKE; Vors. der Gruppe BSW."
3544,Weiss,"Bischöfliches Abteigymnasium und Leibniz-Gymnasium in Duisburg Hamborn, Abitur. Freiwilliges soziales Jahr. Studium der Rechtswissenschaften an der Ruhr-Univ. Bochum, 1. und 2. juristisches Staatsexamen. Rechtsanwältin in Duisburg-Hamborn und später in Dinslaken. 1992 Gründung Verein ""Pangasinan e. V."", 1997 Mitbegründerin SOLWODI Duisburg. Seit 1980 Mitgl. der CDU, u. a. stellv. Vors. der Kreis-CDU und Frauenunion Duisburg, 1989/98 Mitgl. der Bezirksvertretung Hamborn und dort Vors. der CDU-Fraktion, 1998 Wechsel zur CDU Dinslaken. 1999/2009 direkt gewählte Bürgermeisterin der Stadt Dinslaken. 2010/16 Vors. der Frauen Union im Kreisverb. Wesel, 2012/18 Mitgl. Bundesvorst. der CDU Deutschland, 2016/21 Kreisvors. der CDU im Kreis Wesel. - MdB seit Okt. 2009; Jan. 2014/März 2018 stellv. Vors. der CDU/CSU-Fraktion; März 2018/Dez. 2021 Parl. Staatssekretärin beim BMin. für Gesundheit."
3557,Ebner,"1983 Abitur in Ebersbach. 1984/86 Zivildienst. 1986/93 Studium Agrarwiss. Univ. Hohenheim. 1993/2000 freiberufl. Landschaftsökologe, 2000/11 staatl. Naturschutzverwaltung Baden-Württemberg. Seit 1999 Mitgl. Unabhängige Grüne Liste Kirchberg/Jagst (UGL); seit 2002 Mitgl. Bündnis 90/Die Grünen, 2008/17 Kreisvors. Bündnis 90/Die Grünen Schwäbisch Hall, 2009/11 und 2013/21 Mitgl. Landesvorst. Bündnis 90/Die Grünen Baden-Württemberg. 1999/2004 Stadtrat (UGL) der Stadt Kirchberg/Jagst. Mitgl. NABU, Berufsverb. der Landschaftsökologen Baden-Württemberg (BVDL), Bundesverb. Beruflicher Naturschutz e. V. (BBN), Fachagentur Nachwachsende Rohstoffe e. V. (FNR), Europa-Union Deutschland. - MdB seit Mai 2011; 2014/16 und 2017/21 Sprecher der Landesgruppe Baden-Württemberg der Fraktion Bündnis 90/Die Grünen; seit Dez. 2021 Vors. Ausschuss für Umwelt, Naturschutz,		 nukleare Sicherheit und Verbraucherschutz.
."
3559,Lindner,"Abitur am Europa-Gymnasium Wörth am Rhein. 2002/07 Studium der Technischen Volkswirtschaftslehre Univ. Karlsruhe (TH), Abschluss als Technischer Diplom-Volkswirt 2007; 2011 Promotion zum Doktor der Wirtschaftswissenschaften (summa cum laude) ""Zur Manipulierbarkeit der Allokation öffentlicher Güter"". 2001/02 Zivildienst an der Landesanstalt für Umweltschutz Baden-Württemberg. 2007/11 Wissenschaftl. Mitarbeiter am Karlsruher Institut für Technologie. Seit 1998 Mitgl. BÜNDNIS 90/DIE GRÜNEN, seit Nov. 2004 Vors. Kreisverband Germersheim und Stadtverband Wörth. 2005, 2009, 2013 und 2017 Direktkandidat für den Deutschen Bundestag. Jan. 2007/Juli 2011 Mitgl. Kreistag Germersheim, 2009/Juli 2011 Mitgl. Stadtrat Wörth am Rhein, 2009/Juli 2011 Vors. der Kreistagsfraktion. - MdB seit Juni 2011; 19. Wahlperiode Sprecher für Sicherheitspolitik der Fraktion BÜNDNIS 90/DIE GRÜNEN; Vors. der Landesgruppe BÜNDNIS 90/DIE GRÜNEN Rheinland-Pfalz; seit Dez. 2021 Staatsminister bei der BMin. des Auswärtigen."
3562,Walter-Rosenheimer,"Seit 2002 Mitgl. der Partei Bündnis 90/Die Grünen, 2003/09 Sprecherin des Ortsverbandes Bündnis 90/Die Grünen, Germering, 2003/11 Sprecherin des Kreisverbandes Bündnis 90/Die Grünen Fürstenfeldbruck, 2004/08 Sprecherin des Landesarbeitskreises Frauenpolitik der bayerischen Grünen, 2004/10 Mitgl. des Parteirats der bayerischen Grünen, 2008/12 Delegierte zur BAG Wirtschaft Bündnis 90/Die Grünen, 2008/20 Mitgl. im Lenkungsteam der LAG Wirtschaft und Finanzen der bayerischen Grünen. 2008/13 Gleichstellungsreferentin im Kreistag Fürstenfeldbruck, 2008/18 Kreisrätin im Kreistag Fürstenfeldbruck. - MdB seit 2012; 2012/13 Mitgl. Ausschuss für Wirtschaft, Technologie und Technikfolgeabschätzung; 2012/13 stellv. Mitgl. Ausschuss für Familie, Senioren, Frauen und Jugend; 2012/17 Mitgl. der Kinderkommission, 2021 stellv. Mitgl.; 2013/17 Mitgl. Parl. Beirates für nachhaltige Entwicklung, 2013/21 Mitgl. Ausschuss für Bildung, Forschung und Technikfolgeabschätzung, 2013/21 Mitgl. Ausschuss für Familie, Senioren, Frauen und Jugend, 2013/21 Sprecherin der Fraktion Bündnis 90/Die Grünen für Jugendpolitik, Ausbildung und Weiterbildung, 2018/21 Obfrau der Fraktion Bündnis 90/Die Grünen in der Enquetekommission ""Berufliche Bildung in der digitalen Arbeitswelt"", seit 2021 Mitgl. Ausschuss für Menschenrechte und humanitäre Hilfe, Mitgl. Petitionsausschuss, Mitgl. der Interparlamentarische Union (IPU) und stellv. Vors. der Parlamentariergruppe Westafrika."
3563,Todtenhausen,"1957/66 Schulbesuch in Wuppertal. 1966/70 Ausbildung zum Elektroinstallateur. 1970/72 Wehrdienst. 1977/78 Meisterschule bei der HWK Düsseldorf, Abschluss als Elektroinstallateurmeister. 1978/81 Betriebsleiter, 1981/88 selbstständiger Elektromeister, seit 1988 Elektromeister und Geschäftsführer. Seit 2003 FDP-Ortsverbandsvors. in Wuppertal, seit 2006 stellv. Kreisvors. der FDP Wuppertal und stellv. Vors. des FDP-Bezirksverbandes Düsseldorf, 2006/11 Landesvors. des Liberalen Mittelstands NRW und stellv. Vors. der Bundesvereinigung Liberaler Mittelstand e. V. 2004/Okt. 2017 Stadtverordneter im Rat der Stadt Wuppertal. Bis Dez. 2020 ehrenamtlicher Vorstand einer Wohnungsbaugenossenschaft. Mitgl. des Aufsichtsrates der Gemeinnützigen Wohnungsbaugesellschaft Wuppertal (GWG) - MdB Mai 2012/13 und seit Okt. 2017; Sprecher und Obmann im Petitionsausschuss; Handwerkspolitischer Sprecher; Vors. der AG Mittelstand und Handwerk sowie der AG Kommunalpolitik der FDP-Fraktion."
